prolific_id,A1,A2,A3,A4,A5,A6,A7,A8,story,p_type,recall,q1,q2,q3,q4,q5,q6,q7,q8
5f2ef358d45f6110ad8ba935,""" briefcase""","""are you a gymnast""","""when they get back from their trips for dinner""","""11:55""","""5""","""annas shoes""","""i dont know""","""coach""",42,soc,David and Anna met in an airport after Anna was almost hit by a luggage cart while she was tying her shoes. David helped save her then helped her get to her flight at 11:55. They went to the same high school and she graduated 3 years before him. He asked her on a date and she gave him her business card.,0.0,0.0,0.0,0.0,0.0,3.0,1.5,1.25
5f88564087e5152dbbeba343,"""  manager ""","""500""","""jeff""","""no""","""1 hours""","""safety""","""b""","""business class""",32,loc,,0.0,0.0,2.0,2.0,0.0,1.0,0.0,0.0
5f8eef372ace000b7ce1dca4,""" 5 min""","""shift change""","""c""","""33c 36f""","""days""","""personality differences""","""yes, if they are a bore""","""jessie""",12,np,"A couple, Calvin and Jessie, are returning from a trip abroad. Jessie has been contemplating ending the relationship because of personality differences. Calvine, unaware is surprised by this as they are navigating through security and boarding their plane. He feels as if he went above and beyond to please Jessie.  They decided mutually that they should end things. Luckily being seated separately for the flight home they shake hands and Jessie asks Calvin for her philosophy books back. ",0.0,2.0,0.0,1.75,0.0,2.0,3.0,1.0
5f47f19248a89010ebae8705,""" it is in the basement so there are no windows""","""they are in a history class and the days lecture is about mummies and mummification""","""mummification""","""there is a quiz the following week""","""i dont remember""","""are you from La""","""at 8pm in front of her dorm for a walk""","""noon""",44,loc,"Leon sees a woman in a lecture hall, who he is sure he has met before but he can't place her.  He passes her a note asking if she's from LA because she looks familiar.  She says that she isn't.  When she looks at him, she feels he is nice and trustworthy and immediately likes him.  They agree to meet for a walk later that evening.  The professor wraps up his lecture about mummification, and everyone leaves the class except the two students.  She tells Leon she has to go to another class but that they'll meet tonight.",1.25,2.0,0.25,1.25,0.0,3.0,3.0,3.0
5a790a908fe2dc0001058b37,""" 4 hours""","""Man with suspicious amount of metal objects""","""11""","""2A and 2B""","""7 years""","""2 two pink diamonds""","""Pink ring case""","""Her best friend""",22,np,"Sven and Isabel have been dating for several years and Sven is planning on proposing to her. The line is being held up because a man with a suspicious amount of metal is being searched. Isabel realizes that her laptop is buried underneath a bunch of stuff and, in the commotion, Sven forgets that he has the ring and fails to put it in the scanner. As soon as security asks him to remove the object from his pocket, Sven proposes to Isabel.

A crowd gathers to hear her answer. Isabel gets nervous and flees with Sven in tow. Once they're away from the crowd she excitedly accepts his proposal and the couple has a pleasant walk towards their gate. I don't remember what Sven does but Isabel texts her best friend and the two reach their seats. After they sit down, a woman talks to the couple about how they're trending on Twitter because she's been live tweeting the situation. Isabel is mortified, but happy.",0.0,3.0,0.0,2.0,0.0,3.0,0.0,3.0
5c7af0dc9782c300011cd107,"""  ""","""$28,000""","""Charlie Clique""","""Handshake""","""Large lecture hall""","""Architecture Class and Roman Architecture""","""Roman historical architecture""",,34,soc,The two were meeting in a college class to discuss an investment. The investor had spoken with the other's involved and offered a small upfront offer that was ultimately countered to be double (the original price) due to the need to implement the plan with full funding. This negotiation was happening while a class was also being presented on Roman history. ,0.0,1.5,0.25,0.0,0.0,2.75,0.0,0.0
5e6a81569f3af202438c5fde,""" Brite and sunny""","""pumpkin puree""","""5""","""14.55 cash""","""23 months""","""1""","""a ring box""","""mom """,23,soc,Alex is sweaty from nerves entering the store. Alex and Chloe having been together for 23 months,2.0,2.0,1.5,2.5,3.0,2.0,0.0,3.0
5e3dff6b8714b707b9a258b0,""" For quite some time.""","""He wants to focus more on work and a relationship is taking up too much of his time.""","""Sadie does not want to break up and she believes they can find a better balance so he can have both work and a relationship.""","""Sadie wants back a camera and a beatles poster.""","""I do not remember.""","""The menu is laminated with silly names for food items""","""Sadie orders a reuben sandwhich and Thomas orders a burger.""","""I dont believe Sadie ate her food, but Thomas believes his tasted bad and left a fish like taste in his mouth.""",11,soc,"Thomas arrives at a restaurant and is nervous because he is planning on breaking up with his girlfriend. Sadie, his girlfriend arrives and Thomas requests from the female hostess a more private seat in the back, I believe it was a booth seat. They are seated and after a moment Thomas declares he thinks they should break up because he wants to focus on work opportunities and believes the relationship is taking up too much of his time to allow him to focus as much on work as he would like. Sadie asks if there could be a compromise, such as seeing each other less, but Thomas does not seem receptive. The waiter comes and they both order after realizing they hadn't noticed the menus in front of them they quickly scan them and pick out food items, Thomas picks a burger, and Sadie asks the waiter about the Reuben sandwich which the waiter mentions is excellent. The food arrives, I think Sadie may have went to the bathroom while Thomas sat nervously biting his lip and picking at a hangnail. Sadie, realizing that she can not convince Thomas to reconsider grabs her food and shakes it at Thomas telling him she wants her camera and beetles poster back before also telling Thomas to stay away from her. She storms out and Thomas, after a moment, begins eating his burger which he thinks is not very good and wonders why it might taste so bad.",0.0,3.0,3.0,1.75,0.5,1.0,2.75,3.0
5ee551895cb6e20f96c7d44a,""" He has been thinking about breaking up for a few weeks""","""Thomas wants to break up because he feels that his life is going in a different direction. He thinks that he wants something different in work.""","""Sadie does not want to break up and even suggests to Thomas that they can see each other less while maintaining the relationship.""","""Sadie wants her Beatles poster and polaroid camera back.""","""The restaurant had barstools and tables.""","""The menu consisted of sandwiches such as burgers and reubens.""","""Thomas ordered a burger and Sadie ordered a Reuben.""","""Thomas found that his burger had a fishy taste and Sadie left the diner before she at any of her Reuben.""",11,soc,"Thomas and Sadie are a couple. Thomas called Sadie over to a diner to meet up. Thomas asks the waitress for a table in the back, which she provides to them. Once they finally sit down, Sadie asked him how things have been. Then, Thomas shocks her by saying that he wants to break up. He claims that he is trying to find something different to do at work and that he feels like he can't be with her anymore. After he breaks the news, the waitress comes over and asks them if they'd like anything. Thomas orders a burger and Sadie orders a Reuben. After the waitress leaves, Sadie starts crying and tells Thomas that their situation doesn't warrant a breakup. She claims that they can see each other less if he's going to be busy. As she cries, people at the diner look over but they realize what's happening, so they look away. Thomas is adamant that he wants the breakup and the waitress comes over with the food. She asks if there's anything else that they would like but they decline to have anything. After the waitress leaves, Sadie waves half of the Reuben in front of Thomas and tells him that she wants her polaroid camera and Beatles poster back. After saying this, she storms off and the diner's door lets off a happy jingle. Thomas bites into his burger and finds that it has a fishy taste. He wonders if it's due to everything that transpired or if it's the restaurant's fault.",0.75,0.25,3.0,1.5,1.0,1.0,3.0,3.0
5f87229eedaff10de2c1844a,""" for some time, I think at least several weeks""","""their difference in personalites ""","""no Calvin does not want to be broken up with even though he says he thinks its a good idea because of their difference in priorities""","""Jessie wants her books back""","""I do not remember""","""the poor infra""","""no idea, 24 a?""","""34a and 27e?""",12,np,"Jessie and the guy went on vacation, Jessie had decided she wanted to break up with him, then arrived at the airport after their trip, they go through security, he makes remarks about the poor infra for the airport and Jessie can't take it and bursts out that she wants to break up. He gets upset and then when they walk to their gate he says he thinks its a good idea they break up but doesn't sound like he means it. Then she tells him to have a good flight after they board the plane to their different seats and asks him to send her her books back which he doesn't appreicate. ",0.0,0.0,2.0,0.5,0.75,2.0,0.5,2.0
5f32aab12a9f82000854c3ea,""" benches with plants on the wall""","""neon in color with japanese writting and small english tranlation""","""vegetable roll japanese beer tuna roll""","""delicius ""","""phone""","""Is your head ok?""","""concert by an egyptian artist""","""james was late. 8""",41,np,James was having lunch alone when he saw a woman walk into a glass door because she was not paying attention. She was typing on her phone.  They ended up being sat near each other and started a conversation.  They shared a lunch of Japanese food.  She had a beer while James did not order a drink.  They talked about her embarrassing incident and she noted it was not a big deal.  Conversation steered towards Egypt and concerts.  They will end up seeing each other for a convert later that night.,1.0,3.0,2.0,1.25,0.0,2.0,2.0,0.0
5f84d54bdf92611a668a68cd,""" japanese theme""","""plastic""","""salmon roll, japanese beer, ""","""enjoyed it""","""cellphone""","""are you okay?""","""at night for a concert""","""3:00 pm""",41,loc,"Jessica hit her head while looking at her phone when walking into a sushi restaurant. The people near the cash register see her and she is embarrassed. Seeing this unfold nearby was John who noticed the clumsy act. The hosts seated them at the bar alone from each other, where John asked what happened? She replied with a question about whether he was ever stung by a scorpion, perplexed John answered in the negative. The waitress comes by to take orders, Jessica ordered a salmon roll and a Japanese beer, while John ordered other types of sushi. They talked and when it hit 3:00 PM John had to leave but not before setting up a date to watch an evening concert. He'll be picking her up.",0.25,0.0,1.5,2.0,0.0,1.75,2.0,3.0
5f8aa2f3c9a603151ac60028,"""  cafe""","""namenum_enter""","""next week""","""evening""","""with light""","""pasta""","""coffeenum_enter""","""very much""",41,soc,About two client in a restaurant,0.0,0.0,0.0,1.25,0.0,0.0,0.0,0.0
58d7d2c2e9b6dc000129148a,""" They still had a decent amount of time.""","""They were upset at eachother and got into an argument.""","""The third gate""","""They sat in different seats in the same section of the plane, which I cannot recall.""","""She had been thinking about it for quite some time.""","""She felt he was annoying.""","""He agreed that they should break up, seeing as she thought poorly of him.""","""She wants her books back from him, and he couldnt believe her.""",12,loc,"He and she arrived at the airport together. They were heading to the airport to go on a vacation to the united states. At the airport, she became bothered, and mentioned to him that she thinks they should break up, citing that he was annoying and hard to be around. He was a bit taken aback, but agreed they should break up if she thought like that of him. They agreed that it would be over once they landed in the states. They showed their cards so they could get onto the plane. On the plane, they found they would be seated separately. She asked him if she could get her books back from him, and he was in disbelief at her arrogance to ask such a question right after breaking up with him, especially because the break up was all of a sudden and she never mentioned the problems to him before.",0.25,0.0,0.0,0.25,0.0,0.0,1.75,1.5
5c52436f5acab700012608b9,""" Ms. Bianchi is a saleswoman for an Italian cheese company, Ms. Morrison is the head of an american grocery store franchise.""","""15,000 USD""","""Orange Distributers""","""Drinking a tiny bottle of champagne from Ms Morrisons purse.""","""Busy for Halloween""","""crackers, ketchup, and sparkling water""","""there are 13 open, the characters go to number 6""","""the groceries are 20 dollars and change, and Ms Morrison pays with a check""",33,soc,"Ms Bianchi and Ms Morrison are two businesswomen looking to make a deal about Italian cheese in the dairy isle of a grocery store in late October. Although Ms Morrison is not the most receptive at first, Ms Bianchi wins her over and convinces her that it would be a profitable decision to buy thousands of dollars of cheese. They check out their scant items in line 6, with Ms Morrison making small talk with the cashier and paying with a check. She then brings out a small bottle of champagne from her purse and shares it with Ms BIanchi in celebration of their business deal. Ms Bianchi is charmed and tickled by both the check and the champagne, and decides she likes working with Americans.",1.0,3.0,2.0,2.0,2.25,2.0,2.0,3.0
5c0fa2324324e80001c951c9,""" 20 minutes""","""metal detectors""","""f""","""33a 36f""","""since the before the vacation""","""they are not compatible""","""they did not know and just thought the other person was annoyed with them""","""philosophy books""",12,np,A couple had been on a vacation and are in the airport awaiting their return flight. The woman wants to break up with the man and wants to do it as soon as possible so she does it while they are waiting on their flight. She just thinks they are not compatible and was thinking of breaking up before they even went on the vacation. The man is kind of shocked that she wanted to break up but it explains while she seemed so annoyed with him during the vacation.,0.5,0.0,0.0,2.0,0.0,2.0,0.0,2.0
59d75f1b8fd07a0001841feb,""" cell phone""","""are you ok?""","""later tonight, Egyption concert""","""3""","""i do not know""","""japanese with small english below those words""","""egg roll and beer and 2 rolls""","""i do not recall""",41,loc,"man at restaurant. Woman runs into glass door b/c she's not paying attention. she hits her head. they're seated next to each other. he asks if she's ok. she tells him story about a scorpion and says the pain isn't as bad as that. she was in Egypt when that happened. they ordered their food. they talked (probably flirted too). he invited her to a concert that evening b/c it featured an Egyptian artist. she consented to his invitation. they exchanged phone numbers. it was 3 pm. he left to go back to work and paid for both meals w/ a $50 bill. he was excited by the idea of his date w/ her. the story said she disguised her excitement better than he did. nothing was said about Covid and/or social distancing. though the story made no mention of that, a lot of conclusions could be put in here but you might take my attempts at humor the wrong way.",0.0,2.0,1.25,0.0,0.0,1.25,2.75,3.0
5f8c971713143e0eeebdcd15,""" 3""","""flight delay""","""3""","""7""","""same the school""",,""" yes""","""3""",42,loc,,0.25,0.0,0.0,1.25,0.0,0.0,0.0,0.0
5f69edea0450c300083bcffd,""" ms bianchi is an accountant and ms morrison is a sales person ""","""5000""","""orange grocery""","""ms bianchi open a bottle of champagne ""","""it have halloween decoration""","""nut cracker""","""6""","""2300, cheque""",33,soc,The story i heard is on investment and partnership,1.0,0.0,2.0,2.25,1.0,0.5,2.5,3.0
5f8e26c14662151fcb6d07b7,"""A couple of years""","""1 diamond, not sure about the color""","""A red box""","""Her best friend""","""Don""","""Because Sven has a red box in his pocket""","""c40""","""2a 2b""",22,np,"At the beginning of the story, Sven and Isabel are at the airport, ready to go on a trip. Sven is nervous, fiddling with the ring he had bought to propose to Isabel. They move onto to the security check, at which the security guard tells Sven to empty his pockets. This is because he had left the red box with the ring in his pocket. There, he decided to propose to Isabel. However, Isabel was too embarrassed to answer in front of the crowd, so she ran. Soon, she accepted his proposal, and they went to gate c40. They were both overjoyed and they waited for their plane. When they got there, they were congratulated by some fellow passengers, and Isabel was very embarrassed.",0.0,0.0,3.0,2.0,0.0,0.0,1.0,3.0
5f129bc4329d461f67269693,""" two hours""","""they have to put their things in bings""",,"""business""","""wine""","""$800""","""east""","""handshake""",32,loc,Jeff and William are at the airport together and had met the night before and agreed to talk at the airport. They made a deal where William would buy wine from Jeff to show to his boss and it would make both of their companies money. They shook hands. Jeff jogged to his gate and got onto the plane and emailed his work from his phone before ordering a wine for himself from the flight attendant. ,3.0,0.0,0.0,2.0,0.0,3.0,0.0,3.0
5d7b2e78698dea001853b5ec,""" yes""","""yes""","""yes""","""yes""","""2 hour""","""i donot remember ""","""i do not remember""","""i do not remember""",21,loc,a dinner between senna and alvira in a nice restaurant but with a very small menu,0.0,0.0,0.0,0.25,0.0,0.0,0.0,0.0
5eb1cc5bbd95623229c961a5,""" 1 hour""","""a guy ahead of them had too many metal pieces on his person""","""2""","""2a and 2b""","""11 monhts""","""2 pink diamonds on a silver band""","""it was present in its velvet box that he had forgotten in his pocket""","""her best friend""",22,soc,"They were in an airport, Sven was excited to propose to Isabel because he had just gotten her parents permission, he mentioned they had been dating for 11 months and looked at the ring in his pocket (which had 2 pink diamonds on a silver band) They were walking to security but got held up because a guy in front of them had a lot of suspicious metal pieces on his person, they took off their shoes, Isabel couldn't find her laptop so had to dig through all the luggage making Sven hold it all until she found it and put it in the bin, they started going through security but Sven got held up because he had forgotten about the ring in his pocket, the airport security person wanted him to step aside but he just turned to Isabel and proposed, mentioning that he hadn't intended to do it that way, everyone else around them got closer to see what was happening, Isabel got nervous because she was shy and didn't like everyone looking at them and grabbed their shoes and luggage and started running off, Sven grabbed the rest of the bags and followed her (without his shoes), once they were a reasonable distance away Isabel told him that she accepted and screamed throughout the airport, Sven mentioned that she had made him nervous because he didn't think she was going to accept, they were both excited, she texted her best friend and he hugged the flight attendant person because he was so happy, they sat down on their seats (2a and 2b), people who had seen it came up and congratulated them, a person mentioned that she had been live tweeting the whole thing and it had gone viral, which sort of weirded out Isabel but she was still happy about it. The end",2.0,3.0,0.0,2.0,3.0,3.0,2.0,3.0
5f8e2a9201810e1f2b9f63a2,""" Ms Bianchi: seller Ms Morrison grocery store manager""","""1500""","""Pinks""","""Popping of a champagne cork""","""There are pumpkins displayed by the door.  It is crowded""","""Ketchup,crackers,sparkling water""","""10 and number 6""","""28 dollars, Mrs Morrison pays by check""",33,soc,"Ms Biannca meets Mrs Morrison in order to discuss her (Morrison) grocery store buying some cheeses.  They meet at the front of the store.  Mrs.  Morrison is known to be unconventional and prefers to meet at the location to help remember what they should focus on.  They discuss business.  Mrs Bianca says her cheeses will drive sales in other vectors.  They discuss an import tax, and solve that.  Mrs. Bianca offers to buy crackers to sample the cheeses.   Mrs Morrison says she will buy them.  She checks out with the crackers, ketchup, and sparkling water.  She pays by check.  She knows the employees.  There are 10 lanes open.  They close the deal.  Morrison has champagne in her purse and pops the cork.  Miss Biannca decides she likes doing business with Americans.",1.25,3.0,3.0,2.0,1.75,3.0,0.0,3.0
5dd9df0e946f7c97406a55ea,"""dont recall""","""anna makes a mistake""","""front gate""","""dont know""","""suitcase""","""are you a gymnast""","""when they come back to town""","""not sure""",42,loc,"Anna meets David as she is getting ready to board a flight but then runs into a slight problem. She is almost late, but David ends up helping her and they agree to meet again sometime. She gives David her business card before leaving",0.0,0.0,0.0,0.0,0.0,3.0,0.0,0.0
5e30e028dea8d60e2ab7abd6,"""80s theme ""","""laminated""","""burger""","""Saddie did not try it and Thomas thought it tasted bad""","""couple weeks""","""changing carrers""","""she does not want to break up and she thinks they can make it work if they hang out less""","""polaroid camera and beetles poster""",11,soc,The story was about Thomas breaking up with Saddie in the 80's theme restaurant. He believes that the current situation in his life Thomas needs more time to focus on himself and his career. He wants to change careers and he feels overwhelmed with everything what is going on. Saddie does not want to break up and believes that they can make it work if they would spend less time together. They ordered food but Saddie left the restaurant before she even had a chance to try it and told Thomas that she wants her polaroid camera and Beetles poster back. After she stormed out Thomas tried his food but he did not like it.,0.5,2.0,1.0,1.0,1.0,2.0,3.0,2.0
5e8ba701c2bb4d085e04cd58,""" It has a Japanese decor.""","""I do not remember; I only recall the waitress bringing James and Teresa the menus. ""","""Teresa orders a sushi roll and a Japanese beer. James orders two rolls and no beverage. I think one of the rolls is a spring roll.""","""They enjoy the food very much because the fish is very fresh.""","""James is holding a newspaper.""","""James asks Teresa if her forehead is okay.""","""James is going to pick Teresa up that evening to go to a concert by an Egyptian artist.""","""It is 3 PM when James has to leave.""",41,soc,"James and Theresa, two young people each decide to have lunch at a sushi restaurant. Theresa slams her head in the door coming in. James, who is already in the restaurant with a newspaper, catches her eye and wiggles his eyebrows at her to start the interaction. They are seated near each other at the bar. Both look at the menus they are given, with Theresa taking longer to decide. James makes the first move by asking if her forehead is okay. She then counters with, ""Have you ever been stung by a scorpion?"" and explains, as they banter, that she was stung by a scorpion while studying in Egypt and that bumping into a door pales beside that experience. James notes that he plans to go to a concert by an Egyptian artist that evening. Both order their lunches. There is continued banter, and they have to sit closer together when the waitress places their meals near each other. James decides to go for it and asks her to attend the concert with him, promising it will be free of scorpions. She agrees, and they decide he will pick her up that evening. She gives him her number. Both are happy, as they did not expect their solitary lunches to result in a meeting and date. James has to leave hurriedly when he realizes it is already 3 PM. He says goodbye, and she waves to him from the bar.",0.25,0.0,2.25,3.0,3.0,3.0,3.0,3.0
5f3a99865242340d71f85620,""" half an hour""","""there was a change in shifts for the workers at security""","""tab I don""","""33a and 36f in economy""","""2 weeks""","""he was intollerable""","""yes, if she thinks he is intollerable than he thinks they should split up""","""she wants philosphy books back""",12,loc,"A couple was traveling home from Jamaica, she wanted to split up with him and tells him a the airport. They go through security together and are delayed as there is a change in shifts. They are seated separately on the plane and she tells him she wants the philosophy books she gave him back.",1.0,3.0,0.0,3.0,0.0,0.0,1.25,2.75
5f437f00446374209d7b65b0,""" till reaching  their aim""","""maria cannot keep long distance""","""no, she do not want to break up""",,,,,,14,soc,The story was about Maria and Henri .In the story Maria told Henri that they should break up but actually they both love each other .,0.0,0.0,0.0,0.0,0.0,3.0,0.5,0.0
