prolific_id,A1,A2,A3,A4,A5,A6,A7,A8,story,p_type,recall,q1,q2,q3,q4,q5,q6,q7,q8
56a8bb427f2472000b9522f6,""" busy because it is nearing thanksgiving. there are also many posters by the entrance and products stacked up high""","""pumpkin puree and vinegar. they bought other things too as the total cam to 14 dollars""","""3 open and they went to one nearest the entrance""","""14 dollars. cash""","""23 months""","""white and multiple diamonds. sparkly and dazzling""","""wallet""","""mother""",23,soc,"Chris and Chloe have been dating for 23 months and went to a grocery store to buy some things. It was near to Thanksgiving and it was busy, with various promotions, posters and products piled high. Down one aisle Chloe asked her boyfriend if there was anything they needed and he just said 'get whatever you need'. Chloe thought something was up but just carried n, picking up pumpkin puree and vinegar. Chris took out his wallet where the engagemnt ring was. He was sweaty and looked at the ring which was a single band and with sparkly white diamonds. As the came to the end of there shop, they got into the queue nearest the exit and Chloe coud tell something was up but thought if he neede to say something he will in his own time. Then suddenly, Chris got down on one knee and asked her to marry him. All their friends came out of hiding and started taking pictures and then came over to hug them. Members of the public also took pictures. Chloe said yes after a slight pause, and shortly after contacted her mother. They then proceeded through the checkout paying 14 dollars by cash, before they went off to celebrate nearby.",1.0,3.0,1.0,3.0,3.0,2.0,3.0,3.0
5c730ca1f674750001df8d09,""" I dont remember, but they were certainly short on time.""","""bins were being rolled in""","""I am unsure""","""Jeff sits in business class, although i dont know the exact seat number and they never said William got onto the plane""","""Wine Product Consultant?""","""I dont know""","""Cant remember""","""Dont remember""",32,np,"Jeff and William met by coincidence one day (exact location I don't remember) where William was hoping to secure a wine production deal that he failed with another client, but luckily Jeff was also in this field too. They schedule a business meeting at short notice for the following da at the security gates before taking their flights. Whilst waiting in queue, they began to speak about their business plans. They got caught up in the queue waiting as airport staffs were wheeling in bins through the security gates. William explains how lucky he was to have met Jeff, he explained the previous client wouldn't take his offer, and so he would offer a better deal for Jeff. They both compromised and reached a deal.. Jeff rans to his boarding gate and sat onto the business class seat. He treated himself with a drink for the success of his business meal and instantly messaged his boss.",0.0,3.0,0.0,1.75,0.25,0.0,0.0,0.0
5e7009d7b3d2255e174696cd,""" it is beautiful""","""small with swirling writing""","""oysters with garlic sauce""","""very much""","""5 years""","""3 yellow""","""chocolate cake""","""dad""",21,loc,"the couple go to a restaurant to celebrate the woman's first homegrown tomatoes. However, in actual fact they have gone so the man can propose after five years of dating. She has no idea. They order food from small menus with no prices on. She goes to the bathroom before they order, when the man slips the three stone diamond ring to the waiter. They enjoyed the oysters with garlic sauce especially. He proposes when the cake is brought out, she says of course yes and then texts her dad. ",0.25,2.0,1.0,1.0,3.0,2.0,3.0,3.0
5ae5e66d3ab2fb0001ef2f3c,""" 2 hours""","""lack of bins""","""8b""","""front section""","""east coast supplier of wines, purchaser of wines""","""$800""","""yankee vines""","""hand shake""",32,loc,"Two men meet at an airport.  One man recalls how they met the night before.  They both complained about wine and foudn they worked in a similar area.  They agreed to meet at the airport at the next day.

There is a hold up at security.  After they pass security they haggle over purchasing wine.  One man proposes 5 crates for $800.  As there is no guarantee of a purchase leading from this the other man declines.  Since their competitor yankee vines also declined this offer it was agreed that they would make another offer.  They share information and one of the men boards his plane and orders a glass of wine.",3.0,2.25,2.5,0.0,1.5,3.0,3.0,3.0
5cd0ca0e657e300001945935,""" with chandeliers ""","""small  with chefs descriptions""",,"""delicious ""","""5 years""","""3 x yellow diamonds""","""a small cake""","""dad""",21,soc,"A couple who's names I can't remember go for a meal in the evening as the male partner wishes to propose after 5 years of courting.

They attend a restaurant by the coast line which is decorated with chandeliers.

The waiter acknowledges the male partner and seats them by the window.

Whilst the female partner is in the rest room the male partner gives the waiter the ring which came from his mother and had three yellow diamonds set within it.

Once the female partner returned they reviewed the small menus which included comments from the chef.

She made a comment of how over the top the meal was for someone who brought him tomatoes 5 years ago, to which he responded they were the best tomatoes he'd ever had.

They ordered oysters and whilst eating he showered her with compliments and fond memories to the point that his eyes began to tear.

After completing their mains the waiter brought over  small cake with the ring placed in the top.

The male partner got down on one knee and proposed to the female with the whole restaurant watching, this happened not long after sunset.

The female accepted his engagement offer and then insisted on texting her father.",1.0,2.0,0.0,1.0,3.0,2.0,3.0,3.0
5ebf19feee7c5b13537f1d35,""" 3 years""","""5 and white""","""ring box""","""her mom""","""bustling""","""bread""","""5 are open, they went to 3""","""14 dollars, paid in cash""",23,loc,"Since I don't remember their names, a man and woman enter a bustling grocery store to get what they needed for the week. The man is visibly nervous since he is going to propose to his girlfriend at this store. They walk up an aisle and the woman asks the man if there is anything they need to get while they are there. Looking at the ring, he said that he wasn't sure and the woman now notices how nervous he is. Out of the 5 lines they choose line 3 to checkout for their groceries. As the man is fidgeting with his wallet, to which the woman notices, he notices their friends standing by the entrance waiting for the proposal to take place. The man then pulls the ring out of his pocket, gets down on one knee, and proposes in front of everyone. The woman is clearly shocked while her friends, customers, and employees take out their phones to capture this sweet moment. After a few moments, she says yes and shoves her ring in the face of a stranger to show how glittery the ring is. She then texts a picture of the ring to her mom while her now fiance pays for the 14 dollar groceries in cash. They all then walk out of the grocery store figuring out where to go to celebrate next.",0.0,0.0,3.0,3.0,0.0,2.0,0.0,3.0
5ea9cf685ce96d13164b381a,""" suitcase""","""were you a gymnist""","""next tuesday""","""10:55 am""","""20 minutes""","""line""","""gate b""","""17""",42,np,"David met Anna in the airport while she was tying her shoe and about to get hit by a cart. He was able to move her out of the way and she became disoriented. They find out they went to the same high school, but Anna had graduated 3 years earlier. They both go through security and David takes Anna's hand and runs with her to the gate. She makes it with 5 minutes to spare. They make plans to meet each other for dinner next Tuesday. Anna gets on the plane and hugs her blanket in glee. David then goes to his gate.",0.0,0.0,0.0,0.0,0.0,3.0,2.0,3.0
5bf18310fb616800014fd2dd,""" quiet""","""pasta""","""1""","""Emmanuella paid""","""months""","""fight too much""","""Yes, they would be happier with other people""","""Liam wants his cat back""",13,np,"Emmanuela and Liam went into a grocery store, because they needed to buy some groceries for a dinner that they were hosting that night. They were fighting again, when Emmanuela spoke up and said that she wanted to break up. Liam agreed, and said that they'd be happier with other people. They agreed to pretend that they were still together for the sake of their guests at dinner. Emmanuela joked that whoever told first, would have to give up the cat. But Liam said that it was his cat.",0.0,0.75,2.0,0.0,0.5,1.25,2.75,3.0
5772908d908f1d0001c38893,""" large and old""","""chemistry""","""something about ions""","""test next week""","""dont know""","""dont know""","""dont know""","""friends""",24,np,A couple gets engaged in a lecture theatre during a chemistry lecture with a slideshow,0.5,1.0,0.5,1.75,0.0,0.0,0.0,0.0
5ebd841ddea21b08a0aa3057,""" a newspaper""","""Is your forehead okay?""","""They will meet at an Egyptian concert.""","""It was 3pm.""","""The restaurant was decorated with wood panels and was a Japanese theme.""","""The menus were in bright colors and the menu items were in Japanese with English translations.""","""James ordered a tuna roll and vegetable roll. Teresa ordered a salmon roll and a Japanese beer.""","""I""",41,np,"A man names James was in a cafe reading a newspaper. While reading, he sees a woman named Teresa who was using her phone and ends up bumping her had against the cafe door. As James glanced at Teresa from his newspaper, Teresa notices him and furrows her eyes at him. They next scene takes place of the couple going to a Japanese bar. As they sit at the bar and look through a bright menu of menu items that were in Japanese that have English translations to them, James asks Teresa if her forehead is alright. Teresa asks him if he has ever been bitten by a scorpion. He says no, and she explains that she has and something like a head bump didn't do much to her compared to the sting of a Scorpion from Egypt. James remembers of an Egyptian concert as both him and Teresa talk about their experiences relating to those topics.  James invites Teresa to the concert and she gives a smirk as he jokingly mention that it is indoors and there won't be and venomous creatures. The waitress comes back to ask the couple if they want to order. Teresa orders a salmon roll and Japanese beer, while James orders a tuna roll and vegetable roll. As they eat, James realizes it 3 pm and that he has to go. He gives Teresa her goodbyes as they both look forward to their next date to the concert.",1.25,2.75,3.0,0.0,3.0,3.0,1.75,3.0
5eca8de81197051fa92b5a6a,"""2 years""","""5 red diamonds""","""a sheet of notebook paper""","""sister""","""it is the nicest lecture hall on campus. it has a big chandelier""","""Chemistry; ions""","""the number of electrons in the nucleus can decrease and the identity of the element does not change""","""a midterm test on the material from the first four weeks of class; next week""",24,np,"Aaron and Lana have been dating for 2 years. Today they are both entering a chemistry class in a lecture hall--the fanciest, nicest one on their campus (it has a big chandelier and big chalkboards)--where they first met in a class together 2 years ago. They also had another class together that year. Today, Aaron is going to propose to Lana; the chemistry professor is in on the surprise. The professor enters the lecture hall, and winks at Aaron on his way down to the front of the room, to which Aaron responds with a grin. The professor introduces the day's lecture topic, ions, and embarks on his lecture, using sodium (Na) as an example of how ions work. As the professor is talking, Lana and Aaron are both trying to take notes, but Aaron is also examining the ring he is about to present to Lana. Because Lana's style is more avant garde, the ring Aaron picked out for her is nontraditional; it has five red diamonds in the setting instead of one big white diamond. Eventually, the professor calls Lana and Aaron up to the front of the lecture hall to do a demonstration, and Lana is extremely confused. When they get to the front of the room, Aaron reveals the ring on a sheet of notebook paper, gets down on one knee, and asks Lana to marry him. Lana covers her mouth with her hand, and with tears streaming down her face, says, ""Yes!"" The rest of the students in the class cheer, and Lana's and Aaron's friends, who have been waiting outside the lecture hall, run in to congratulate the newly-engaged couple. Lana and Aaron return to their seats; Lana retrieves her phone to text her sister about her big news. The professor dismisses the class, saying, ""That's enough excitement for one day."" He reminds the students of their upcoming midterm exam, which will cover the material from the first four weeks of the course, and which will be held next week.",1.75,2.0,1.0,2.75,0.0,3.0,3.0,3.0
5460ef52fdf99b49ea4b5906,""" it had halloween displays with pumpkins""","""crackers, sparkling water""","""lane 6, 4 open""","""23 dollars, cheque""","""cheese salesperson, supermarket manager""","""50,000 dollarsbackslash""","""orange groceries""","""mini champagne""",33,loc,"Two people, a cheese salesperson and a supermarket manager meet at the entrance of a grocery store. They shake hands and start to talk about the deal. The supermarket manager isn't keen on purchasing cheese and says that she doesn't think it is worth expanding, but the salesperson convinces her that her sales will increase, including with cheese-related items like crackers. The supermarket manager is persuaded and agrees to the deal, they agree to try the cheese with some crackers. They share a mini-bottle of champagne.",2.0,2.0,1.5,3.0,1.75,0.0,2.5,3.0
59feed1da383a100011b3eaa,""" it is large with projectors""","""It is about Roman architecture in the era of Augustus.  I dont remember the class name.""","""Augustus wanted to transform Rome into the new Athens""","""the midterm paper is due on thursday and should be emailed to the TA""","""Charlie is a fund manager for a campus investment group and Alma is founder and CEO of a website""","""$28000""","""Churchill""","""a hug""",34,loc,"Charlie is sitting at the back of the lecture hall and beckons Alma to come and sit with him as he has a deal to discuss.  Charlie is a fund manager and Alma runs a website and is looking for investment of $56000.  While the professor is lecturing on ancient Rome, Charlie offers Alma half the money now and half in the future if the business does well.  Alma turns this down because the company needs all the money to meet its targets and she threatens to go to Churchill, which is a competitor.  Charlie backs down because his group have already discussed such a possibility and have agreed to invest the whole sum if necessary.  They hug and arrange to meet to sign the paperwork the following day.  The professor reminds the class that the mid-term paper is due this week and should be emailed to the TA.",1.0,2.5,1.0,3.0,2.5,3.0,2.0,3.0
5c2bbcc63ea0310001d7257e,""" they are in a red lobby ""","""the menus are quite fancy ""","""some meat ,i think steak and a drink ""","""they thought the food was subpar and the meat was overcooked""","""business managers of directors""",,,"""clinking there glasses togather""",31,loc,"two business managers or directors meet in a hotel to discuss merging there two business.The both order food which they thought was subpar and at the end of there meals confirm that a deal can happen.They clink glasses and look forward to working togather
",0.0,0.0,1.25,2.25,0.5,0.0,0.0,3.0
5e9fec0f0450b519deaa43a5,""" For a while now.""","""Wants to focus on developing career on his own.""","""No, she did not, and she was prepared to work on the relationship.""","""Beatles poster and polaroid camera.""","""Like a 1970s diner.""","""laminated""","""A burger and something I did not recognise.""","""She did not eat, and he did not like the burger.""",11,soc,"The man was dreading the conversation. They entered the diner and asked the waiter for a table in the back. She used how his day had been and he said that he needed to take a break from the relationship. The waiter took their order. She began to cry and people looked and then looked away when they realised what was happening. The waiter brought their food. She waved her food at him and then left. He continued to eat, but the food had a fishy taste which he did not enjoy.",1.0,2.0,1.0,1.0,0.75,3.0,2.0,2.0
59de4ee5d838ae0001850567,""" It was dark as it was in the basement.""","""The history of Egypt""","""They are talking about the process of mummification.""","""2""","""a pen""","""a note from leon""","""that evening for a date""","""cant remember sorry""",44,loc,"It was a story about 2 students attending a lecture on history in Egypt. Leon believed that he had seen Ariona before, and eventually sent her a note to attract her attention. There was no indication that she remembered him, but she seemed happy to meet up with him later that evening.",0.0,2.25,0.5,0.0,0.0,0.0,1.25,0.0
561fb820ed6e5a000fc7ec68,""" 5 years""","""3 canary yellow diamonds from his Grandmaapostrophes wedding ring""","""A small cake""","""Her dad""","""chandeliers and views of the ocean.Sounded very classic and fancy""","""Small menus with selections from the head chef, the font was cursive and there were no prices""","""Senna had oysters and Alvira had scallops""","""They loved it, the oysters tasted like the ocean""",21,soc,"Senna and Alvira, a couple who had been together for 5 years, went to a restaurant for dinner, the restaurant was on the sea front with beautiful views and decorated with chandeliers. Once the couple sat at their table they looked at menus, these were small menus with the options for the day selected by the head chef, there were no prices and the writing was in cursive.
Alvira went to the powder room, whilst there Senna checked the ring in his pocket. The ring was adorned with 3 canary yellow diamonds from his Grandma's ring and gave it to the waiter when he ordered their dishes. Alvira was having scallops and Senna was having oysters.
Once Alvira returned she told Senna that this was far too lavish to celebrate her growing her first tomatoes. He told her they were the best tomatoes he had ever had and should be celebrated and then proceeded to tell her how much he loved her.
Their food arrived and it was delicious, tasting like the sea.
Once they had finished, the waiter approached with the ring atop a small cake and Senna got down on 1 knee and asked her to marry him. Alvira was shocked and after a few moments said yes. The whole restaurant cheered.
Alvira then exclaimed that she must text her dad.",2.0,3.0,3.0,3.0,3.0,3.0,3.0,3.0
5d026ba86c626e0019202f6a,""" It was 80s diner""","""single sheet that are laminated""","""familiar orders I only remeber the Reuben Sadie had""","""Thomas did not like the food""","""Past couple of months since thinking of job change""","""He is going for a job change and doesnt think he will have enough time""","""No she thinks they can just change how much they hang out instead of break up""","""Sadie wants her polaroid camera and Beatles poster back""",11,np,The guy was dreading meeting up with his girlfriend (Sadie) because he was thinking of breaking up with her.  He was meeting here at an 80's diner style restaurant.  When they met and hostess asked for seating he asked for a booth in the back.  After talking he seemed distant so she asked whats wrong. He tells her that he thinks they should take a break from the relationship as he is not sure he will have enough time as he is thinking about going for another job that will be time consuming.  She doesnt think they should break up and they can change the amount of time they spend instead of just breaking up.  The waitress comes and they look at their menu and decide to just order something they are use too.  They continue discussing and she starts crying when others notice and try and look away.  The waitress comes back with the food and asks if they want any dessert.  He says no with a blank expression and the waitress walks away.  Sadie then grabs half her Reuben and shakes it at him that she wants her polaroid camera and Beatles poster back and walks out of the diner.,0.75,2.0,1.75,1.0,1.25,1.75,3.0,3.0
5ac607f668b65b00018d60fa,""" sales representative""","""1500""","""orange grocers""","""a bottle of champagne""","""dressed for halloween""","""crackers, ketchup and bottled water""","""10, 6""","""23 dollars, cheque""",33,soc,"The cheese seller and the purchaser met in the grocery store which was dressed for halloween. The purchaser is unconventional and likes to do deals in the place where the product will be sold. They went to the cheese aisle. The purchaser wasn't sure that they needed more cheese but the seller said that higher quality cheese products would lead to higher quality additional purchases and more profits. She offered to buy a box of crackers to test the cheese. The purchaser said that was a good idea but that she'd buy the crackers. She also picked up ketchup and bottled water for later. They stood in the checkout area, which was busy and also dressed for halloween. The seller handed the purchaser a data pack with facts and figures, and the purchaser was convinced it could work, but worried about import tax. They were in aisle 6. The purchaser chatted with the checkout staff because she knows them all. She paid for the purchase, which cost 23 dollars, by cheque which amused the seller. After trying the cheese, they agreed on a deal of 20,000 dollars of cheese which would qualify for reduced import taxes. The purchaser had a bottle of champagne in her bag and popped it in celebration. The seller thought that she loved doing business with Americans.",1.0,2.75,3.0,3.0,1.0,3.0,3.0,3.0
5b9d57e5737d030001ad2cbf,""" I cannot remember""","""tinned pumpkin and cranberries""","""5 and they went to 2""","""14 paid by cash""","""21 months""","""1 white diamond""","""inside his wallet""","""cannot remember""",23,np,"A guy decides to propose to his girlfriend. they have been together nearly 2 years. They meet at the grocery store and do some shopping. It's near Thanksgiving. As they get to the checkouts he asks and presents the ring. Their friends have arrived to see the event. She says yes. Lots of excitement in the store. Photos and videos taken of the event. They pay for the shopping in cash and then leave, to decide where to go to celebrate with their friends.",0.0,1.0,2.0,3.0,1.0,3.0,3.0,0.0
5b1386089663ee0001461b6e,""" Do not remember""","""She could not do a long distance relationship""","""No""","""Maria""","""Do not remember.  I think there was something about light or dust.""","""I think it was Aristotle, about categories.""","""Philosophy.""","""Do not remember""",14,np,"It was set in a lecture hall, to regarded a young couple, who were about to break up, although neither of the wanted to but Maria (I think her name was) did not want to have a long distance relationship.",0.0,1.0,0.25,0.0,0.0,3.0,1.75,1.0
558acd52fdf99b65685f03d9,""" cluttered with posters in the front. a lot of people where in there  as well because they were shopping for Thanksgiving.""","""Turkeys and stuffing""","""Two and the one on the left.""","""$55 and someone paid for them with a credit card.""","""26 weeks""","""1 diamond, and white""","""a crusted box""","""her mom""",23,loc,"They walked into the store. A lot was seen at the front of the store, and posters were up. The store was filled with people as they were getting ready for Thanksgiving. Alex(?) was going to propose to his girlfriend Sarah (?). He was very nervous, and she could tell he was, but she didn't bother him, and she felt like he would talk about it when he was ready. He watched her as she was looking at an item. She also asked him some questions about things they needed, but he said he didn't know. Later, he got down on one knee and asked her to marry him. She screamed ""YES"" with excitement. She put her hand in a stranger's face to show them the ring. She also texted someone to let them know what happened. Also, their friends who were in the store came up to them. And people who were in line let them get in front of them. People congratulated them.",1.0,0.0,0.0,0.0,0.0,3.0,0.0,3.0
5c6fe83f2b44fc000115f3b9,""" I have no idea""","""1 i think""","""a ring box""","""cant remember""","""?""","""ring setting of metal detectors""","""donapostrophet know""","""dont know""",22,np,"Sven went to meet Isabe'ls family and it went well giving him more confidence about proposing.
On the way home at the airport Sven was forced to produce the ring at the metal detectors and proposed there and then. Isabel shocked and embarrassed grabbed Sven and ran but soon excepted the proposal. They got on the plain and some one said they witnessed the whole thing.",0.0,0.0,0.0,0.0,0.0,0.0,1.0,0.0
5eb3d22ffa15221c2e0117c5,""" suitcase""","""how are you?""","""wedding""","""10pm?""","""30 minutes?""","""the metal detector was broken""","""c?""","""first class""",42,loc,"There's 2 people who are at the airport (David and Anna?) who are both going to the same destination. There was mention of a wedding that was taking place? Later in the story, they both go to the carousel where they realise a suitcase is missing, they attempt to look for it. Once found, the female runs towards the male with the suitcase whilst people around them look confused at her.",0.25,2.75,0.0,0.5,0.75,0.0,0.0,1.0
